YY_name,YY_rate,YY_keshi,YY_url,YY_description河北省儿童医院,8,"重症监护科,新生儿科,心外科",http://yyk.familydoctor.com.cn/4157/,河北省儿童医院坐落在省会石家庄建华南大街与裕华路交叉路口，交通便利，环境宜人。医院内绿树成荫，环境优雅，为全省儿童提供了良好的就医环境。该院始建于1989年，设床位365张。年门诊量近22万人次，年住院病人2万多人次，有职工697人(正式职工555人，临时职工142人)，其中医务人员221人，护理人员178人，行政后勤人员156人，卫技类高级职称人员109人，高级政工、会计、工程师18人，技术力量雄厚。该院是一所集医疗、教学、科研、保健、康复、急救为一体的大型三级甲等综合性医院，全国百姓放心示范医院，国家级爱婴医院，河北省百佳医院，河北省卫生系统文明服务三星级单位。该院拥有六排螺旋CT、飞利浦
包头市中心医院,8,"心脏内科,神经外科,肿瘤科,普外三科",http://yyk.familydoctor.com.cn/5774/," 包头市中心医院(原包头市第二医院)始建于1942年，于1998年9月1日正式更为现名，是一所集医疗、教学、科研、预防保健和康复为一体的综合性三级甲等医院。医院占地面积7.3万平方米，建筑面积13.8万平方米;固定资产7.42亿元;开放床位1500张;年平均门诊量近50万人次，年住院4万人次。内设41个临床科室，18个医技科室。现有正式职工1108人，专业技术人员991人，其中：正高101人(教授17人)，副高235人，硕士生导师43人(目前已培养硕士研究生273名)，博士5人，硕士165人。享受国务院特殊津贴专家3人,自治区杰出人才2人,卫生部突出贡献中青年专家、自治区突出贡献专家6人，32"
深圳市宝安区沙井人民医院,8,外伤科,http://yyk.familydoctor.com.cn/519/, 深圳市宝安区沙井人民医院位于深圳西部的珠江口东岸，广深高速、107国道广深路段沙井镇内。服务面积52平方公里，服务人口53万。是一所集医疗、预防、保健、康复、教学、科研于一体的现代化综合医院。是广州医学院的教学医院，湖南医科大学附属二院、南方医院和四川省皮肤病性病防治研究所的协作医院，已与国际紧急救援中心SOS香港部签约，成为合作医院。1994年被评为“二级甲等”医院，1995年被评为“爱婴医院”。2001年初，广东省创伤救治科研中心手外科及深圳市手外科治疗康复中心在该院挂牌成立。该院是第一批医保定点医院。 全院有职工530人，其中高级职称52人，中级职称92人，编制床位280张，实际开放3
台州市第一人民医院,8,,http://yyk.familydoctor.com.cn/8677/, 医院1995年成为温州医学院教学医院，同年被世界卫生组织和联合国儿童基金会授予爱婴医院;1996年省厅授予省级文明医院;1997年成为浙江省高等医学院校合格教学医院;1999年省政府颁发省级文明单位称号;连续七年获得省级创安先进集体;2002年以来，相继与浙江省人民医院、浙江大学附属第二人民医院、附属妇产科医院、浙江省邵逸夫医院等建成协作医院，并与数家省级医院建立远程会诊;2007年创建省级绿色医院;2008年创建省级平安医院;2010年相继成为温州医学院附属黄岩医院(筹)、台州学院医学院附属黄岩医院、浙江医学高等专科学校黄岩临床学院;2011年成为国家高血压科普培训教育基地;2012年成为
东莞市太平人民医院,8,"儿科,骨外科,心血管内科,耳鼻咽喉科,呼吸内科,心胸外科,骨科,烧伤整形科,新生儿科,重症医学科,中心实验室",http://yyk.familydoctor.com.cn/1523/, 东莞市第五人民医院(原东莞市太平人民医院)创建于1954年，现已荣膺三级甲等综合医院、暨南大学非直属附属医院，是莞南地区最大一间环境优美、设备精良、技术力量雄厚的集医疗、急救、教学、科研、保健、康复于一体的现代化市属区域性中心医院。承担多个高等医学院校本科和研究生的临床教学任务，与省内多家知名医院开展着广泛的业务协作。 医院占地面积3.8万平方米，建筑面积8.2万多平方米。全院在岗员工1500多名，卫生技术人员1100多名，其中正高近50人，副高职称人员150余人。设有职能科室20个，临床科室34个、医技及辅助科室14个，外设1间分院、1个门诊部，核编床位900张。拥有核磁共振影像系统、高端
南华大学附属南华医院,8,,http://yyk.familydoctor.com.cn/19902/, 南华大学附属南华医院，前身为核工业415医院，建院于1958年，2002年并入南华大学、成为南华大学直属型附属医院，是一家历经半个多世纪沧桑变迁的集医疗、预防保健、教学、科研于一体的大型综合性“三级甲等医院”。是省市县医保、居民医保、工伤医保、生育保险、铁路医保、新型农村合作医疗定点医院;是衡阳市“十佳医院”、“文明优质服务医院”、“政风行风示范单位”，全国“明明白白看病百姓放心医院”。 医院是衡阳市大外科专业委员会、普通外科专业委员会、手外科、显微外科专业委员会、骨科专业委员会、临床药学专业委员会主委单位。普外科和手外科是湖南省省重点建设临床专科。手外科挂牌为衡阳市手外科中心。 医疗队伍 
湖南省妇幼保健院,8,,http://yyk.familydoctor.com.cn/13865/," 湖南省妇幼保健院成立于1947年，是湖南省卫生计生委直属的集医疗、妇幼保健、临床教学、科研于一体的三级甲等妇幼保健院，是国家博士后工作站、全国妇幼卫生人员培训基地、国家级爱婴医院。 医院概况 医院担负着全省妇女儿童的保健、医疗、健康教育、科研教学、妇幼保健基层技术指导、妇幼卫生人员培训、妇幼卫生信息统计等多项任务,对全省14个市(州)、122个县的妇幼保健机构进行业务管理和技术指导，是湖南省基层妇幼保健技术指导的龙头单位。 全院在职职工1448人，在编职工1190人(其中专业技术人员1005人，管理人员97人，工勤技能人员88人)。坚持保健与临床相结合，医院现有编制床位1050张，年门诊量1"
贵州医科大学第二附属医院,8,"心内科,重症医学科,泌尿科,普外科,肿瘤科",http://yyk.familydoctor.com.cn/19204/, 医院经过近50年的建设和发展，已成为一所集医疗、教学、科研、急救、预防、康复和保健于一体的三级甲等综合医院，贵州省紧急救援中心黔东南急救站设在本院。下辖凯里经济开发区人民医院、贵阳新天振华医院，1所卫生职业技术学校(在校生1200余人)，1所法医学司法鉴定所，1所肿瘤生物及细胞治疗中心。 医院不断引进国内外高新设备和技术，学科专业不断得到发展，医疗、教学、科研水平和服务质量不断提高，形成较强的综合实力。在心内科、神经内科、内分泌科、神经(癫痫)外科、肿瘤科、骨外科、整形外科、泌尿外科、普外科、妇产科、口腔科、口腔颌面外科等专业领域形成了优势品牌。腹腔镜微创技术、皮质脑电波定位手术治疗癫痫、人
深圳市龙岗中心医院,8,"神经内科,传染科,康复医学科",http://yyk.familydoctor.com.cn/676/, 深圳市龙岗中心医院创立于1952年，是深圳市东部最大的一所综合性医院，是龙岗区的急救、医疗、教学、科研、康复和保健中心，1998年被广东省卫生厅批准设置为三级医院，2005年被市政府命名为“深圳市第九人民医院”。2011年，顺利通过广东省卫生厅评审，成功创建成为深圳市东部、龙岗区首家“三级甲等综合医院”。 医院规模 医院占地面积10.9万m2，建筑面积15.3万m2，医院编制床位数880张，实际开放病床855张。2013年，医院门急诊量约224万人次，住院病人约3.6万人次。 医院现有员工2089人，其中：卫生技术人员1647人，正高职称107人，副高职称257人，其中：深圳名医3人、博士研
沧州市人民医院,8,,http://yyk.familydoctor.com.cn/4721/, 沧州市人民医院建于1961年，有着40多年的发展历史，是一所集临床、教学、科研、预防、康复、急救为一体的，三甲规模的大型综合性医院，现开放床位610张。医院总占地面积4.5万平方米，总建筑面积3万平方米，是河北医科大学沧州分院（沧州医专）的附属医院、是承德医学院、河北职工医学院的临床教学医院。 XGY―OPER开放型核磁共振成像系统，CT两台(一台是飞利蒲高档螺旋CT、一台64排全身螺旋CT)、美国GE血管造影机一台，彩超三台（一台是美国ATL超9、一台是GE―VV7专用于心脏超声、另一台是飞利蒲高档彩超），黑白B超三台（一台是西门子、一台是日本阿洛卡、一台是日本本田便携式B超）、大型全自动
池州市人民医院,8,"妇产科,感染科,心内科,呼吸内科,消化内科,泌尿外科,神经外科,普外胃肠病区,普外微创病区,骨一科,骨二科,骨三科,急救中心,普外肝胆病区,急诊外科,肿瘤科",http://yyk.familydoctor.com.cn/9558/, 池州市人民医院始建于1970年。1972年4月正式开诊，历经四十多年的建设，现已发展成为一所具有一定规模、技术力量雄厚、功能齐全、设备先进的“三级甲等”综合性医院，是池州市医疗、教学、科研及预防保健中心、卫生部紧急救援中心网络医院、皖南医学院附属医院、安徽医科大学临床学院、国家级爱婴医院、池州市红十字医院。 医院占地面积8万平方米，医疗用房6万平方米，实际开放床位1099张，员工1198人，正高级职称26人，副高级职称81人，博士1人，硕士研究生104人，在职攻读博士5人，教授、副教授30余人、硕士生导师5人。医院拥有64排螺旋CT、1.5T光纤核磁共振、大平板数字化血管造影机、多功能数字化
钦州市第二人民医院,8,骨外一科,http://yyk.familydoctor.com.cn/3675/, 钦州市第二人民医院是北部湾地区集医疗、教学、科研和预防保健为一体的国家三级甲等综合医院。始建于1933年，是钦州市建院历史最长的公立医院。现有在职职工887人，其中主任、副主任医师70名；开放病床700张。拥有德国西门子核磁共振等高、精、尖医疗仪器设备300多台套，总价值超亿元。按国际标准配置先进的手术室、ICU（重症监护病房）及烧伤病房；与首都医科大学附属北京安贞医院联合成立北部湾地区首家心血管疾病诊疗技术协作基地，是“全国精神文明建设工作先进单位”和广西“科技先进单位”。 全院设置临床、医技科室36个，拥有心胸外科、神经外科、肝胆外科、胃肠腺体外科、创伤手外科、脊椎骨病外科、泌尿外科、妇
温州市中西医结合医院,8,神经内科,http://yyk.familydoctor.com.cn/7586/, 温州市中西医结合医院（浙江中医药大学附属温州中西结合医院），是目前温州市规模较大的集医疗、科研、教学、预防、保健、康复于一体的唯一一所市属公立三级甲等中西医结合医院。医院现有职工1268人，开放床位1000张，其中卫技人员1125人，中高级职称411人，博士、硕士99人，兼职教授33名、硕士生导师7名，温州市名中医3人、青年名中医1人，全国优秀中医临床人才1人，第五批全国老中医药专科学术经验继承人1人，新世纪551人才工程培养对象12人，国家级副主委2名，省级副主委6名，市级学会会长、副会长3人，市级主委7名。 医院座落在新的城市中心区，东依绣山公园，南傍市政府，西临惠民路，北靠锦绣路。为浙
宜春市人民医院,8,,http://yyk.familydoctor.com.cn/10873/,"该医院创建于1937年，是全市唯一的一所三级甲等综合医院。拥有病床600张，正高专业技术人员64人，副高专业技术人员135人，中级专业技术人员396人，博士1名,硕士26名。有享受政府特殊津贴的专家6人，宜春市学科带头人10人，31人获全市新世纪优秀卫技人才称号，10个专业学科被授予全市领先学科。能独立开展试管婴儿技术,体外循环下心内直视手术,心脏介入手术:冠脉造影及支架术、心脏起搏器安置术、射频消融术、二尖瓣球囊扩张术,腹腔镜下胆囊切除、胆总管切开取石、大肠肿瘤切除、卵巢肿瘤摘除、子宫切除等微创外科手术，支气管肺泡灌洗术，游离第二足趾再造拇指，骨髓移植术，断肢断指再植，肾移植术，袖式肺叶切除"
成都市妇女儿童中心医院,8,,http://yyk.familydoctor.com.cn/18304/, 一、医院基本情况 成都市妇女儿童中心医院是经成都市政府批准，在整合成都市第九人民医院、成都市妇产科医院、成都市妇幼保健院、成都市儿童医院医疗资源的基础上新建的一所集医疗、保健、科研、教学、培训为一体的、硬件设施居全国前列、医疗技术水平西部较高、专科设置西部最齐全的具有较强综合实力的三级甲等妇女儿童专科医疗与保健机构。 2011年7月16日挂牌为重庆医科大学非直管附属成都市妇女儿童中心医院，由此，以医疗为主的中心医院逐步成为医疗、教学、科研和预防保健并重的专科医院。 2011年12月通过国家三级甲等妇产科儿童专科医院评审; 2013年10月通过国家三级甲等妇产科儿童专科医院复核。 二、医院规模
湖南省儿童医院,8,感染科,http://yyk.familydoctor.com.cn/14273/, 湖南省儿童医院于1987年6月1日正式开院，坐落在古城长沙梓园路86号，占地82亩，1995年成为国内首批三级甲等综合型儿童专科医院。2013年至2015年全面贯行美国JCI国际认证管理标准。 医院现有编制床位1800张，在职职工1675人，临床专业科室36个，医技科室9个。儿科重症是国家临床重点专科，儿内科、外科、感染、康复和护理是新一轮省级临床重点专科，是湖南省儿童急救中心、省儿童脑瘫治疗康复中心、省青春期医学中心和省儿童眼视光弱视斜视防治中心、省儿科医疗质量控制中心、省儿童重症临床医疗技术研究中心挂靠单位。是中国医师协会儿科医师分会副会长单位、中华医学会耳鼻咽喉-头颈外科专业委员会小儿
中山大学附属第一医院黄埔院区,8,"耳鼻喉科,放射科,外一科,神经内科",http://yyk.familydoctor.com.cn/1631/,中山大学附属第一医院黄埔院区，是中山大学附属第一医院设在广州市黄埔区的一个院区，位于广州市黄埔区黄埔东路183号。黄埔院区目前是广州东部地区专业设置最齐全、设备最先进、设施最完善、规模最大，集医疗、教学、科研、预防、保健为一体，以骨科和创伤急救为重点的三级甲等综合性医院。黄埔院区是广州东部地区的医疗中心，承担着收治本区域疑难、危重症患者的任务。黄埔院区于1995年通过国家爱婴医院评审;1998年获全省“百家文明医院”称号，并连续多次被评为市、区先进单位;2002年成为广州市第一批医疗保险定点单位，并多次被评为医疗保险服务先进单位。2001年，时任广东省委书记、现任中共中央政治局常委李长春同志曾
新余市人民医院,8,"肿瘤内科,妇产科,肿瘤外科",http://yyk.familydoctor.com.cn/10655/,该医院有着70余年建院历史，是新余市唯一的集医疗、教学、科研为一体的大型综合性三级甲等医院。建筑面积33600多平方米，开放病床609张。现有职工750人，其中主任医师23人、副主任医师85人、中级技术职称人员325人，硕士研究生10名。有职能科室11个，临床科室25个，社区服务中心及传染病专科医院各一所。2005年初通过ISO9000国际标准质量管理体系认证。该医院具有较强的人才、技术、设备、管理、服务及环境等全方位优势。内科、外科的技术实力始终保持全市领先地位，并拥有骨科、脑外科、整形美容科、疼痛科、肿瘤科、口腔科等一批特色专科。引进开展介入技术、微创技术、放疗技术、准分子激光近视治疗技术
泸州医学院附属医院,8,"心血管内科,肾内科,神经外科,心胸外科,内分泌科,脊柱外科,血管外科,小儿外科,儿一科,呼吸内二科,神经内科,儿二科,感染呼吸科,感染消化科,检验科",http://yyk.familydoctor.com.cn/18441/, 西南医科大学附属医院位于四川省泸州市，服务于川滇黔渝四省市结合区域3800万群众。医院始建于1950年8月，现有编制床位2200张，设有临床、医技科室近60个，年门诊人次150余万，住院人次13余万，是四川省卫生和计生委员会直属医院，是集医疗、教学、科研、预防和康复为一体的综合性临床教学医院。是国家三级甲等医院、国家爱婴医院、卫计委国际紧急救援中心网络医院、四川十佳城市医院、文明医院、优秀附属医院。是国家卫计委脑卒中筛查与防治基地、全国全科医生规范化培养基地、国家卫计委内镜与微创医学普通外科培训基地、全国首批“临床医学硕士专业学位研究生培养模式改革试点”项目单位、教育部大学生校外实践教育基地
延安市人民医院,8,,http://yyk.familydoctor.com.cn/17164/, 延安市人民医院位于延安市七里铺大街，是一所集医疗、教学、科研、预防、保健、康复为一体的三级综合医院，隶属于延安市卫生局。属国有非盈利性医院。 医院占地面积39亩，医疗用房面积60000平方米。编制床位800张，实际开展床位1100张;拥有职工1375名，各类专业技术人员1182名，占全员的86%(其中高级职称131人，中级职称225人，研究生48人)。 医院共设置科室68个，其中行政后勤科室26个;临床科室32个;医技科室10个。临床科室有：急诊科、120急救站、骨科一病区(脊柱外科)、骨科二病区(关节外科)、骨科三病区(骨创伤科)、骨科四病区(手足外科/烧伤整形科)、妇产科一病区(妇科)、
三亚市人民医院,8,"心血管内科,消化内科,消化内科(内一科),妇产科,创伤显微手足外科,脊柱关节科,骨外科(外二科)",http://yyk.familydoctor.com.cn/3968/, 三亚市人民医院是三亚市政府属下唯一的一所综合性医院，集医疗、急救、预防、保健、教学、科研、康复为一体的三级综合性医院。下设“金鸡岭社区服务中心”和“亚龙湾急救站”2个社区。同时挂牌“海南省南部区域医疗中心”、“中山大学附属第一医院协作医院”和“汕头大学医学院附属三亚医院”。三亚市因其特殊的地理位置，医疗保健凸显重要，三亚市人民医院亦备受国内外各界的广泛关注。 [发展历程] 医院创建于1946年，前身为崖县崖城镇东的东关市医院。1954年4月成立崖县卫生院，同年8月，海南人民医院三亚分院合并入崖县卫生院，并更名为崖县人民医院，后随崖县人民政府，从崖城镇迁来今县城三亚镇;1984年6月，崖县撤县
济南市妇幼保健院,8,,http://yyk.familydoctor.com.cn/11226/,济南市妇幼保健院座落在泉城济南风景秀丽的千佛山下，趵突泉畔，创建于1951年，原为山东省妇幼保健院，1953年改为济南市妇幼保健院。经过半个世纪几代人的艰苦创业，从建院初期的48名职工，20间简陋平房，发展为现在基础设施完善、医疗设备先进、技术力量较强，集保健、预防、医疗、教学、科研、社区服务为一体的三级甲等妇幼保健院。现有在职职工634人，其中具有高级职称110人，硕士生导师13名，博士后、博士、硕士30名，在读博士、硕士37名;设有临床、保健、医技科室28个，职能部门8个。拥有数字X光机、大型彩超、B超，血细胞自动分析仪、全自动尿沉渣分析仪、钼靶X线乳腺机、骨密度测试仪、腹腔镜、宫腔镜、电
辽宁省盘锦市中心医院,8,"内分泌科二病区,普外科二病区,骨科四病区,儿科一病区,儿科二病区,耳鼻喉科门诊",http://yyk.familydoctor.com.cn/15044/, 盘锦市中心医院是由原市第一人民医院、市第二人民医院、市妇女儿童医院、市第六人民医院、辽河医院5所医院整合而成。医院占地面积20.25公顷，建筑面积18.8万平方米，是一所集医疗、教学、科研、保健、康复于一体，具有远程医疗功能的现代化、数字化、综合性的三级甲等医院。 中心医院开放床位2000张，标准病区51个，临床专业36个，临床科室63个，医技专业10个，医技科室17个。内、外、妇、儿等一批专业科室都具有较强的优势，其中十几个科室被市卫生局确定为盘锦市重点专科。一大批专业技术骨干担任着省、市医学专业委员会副主任委员、主任委员及委员职务。医院拥有包括3.0T核磁共振、DR、CR等数字化X线摄影
邯郸市中心医院,8,,http://yyk.familydoctor.com.cn/20141/, 1、建院时间及规模 我院于1946年10月建院，是王任重等老一辈无产阶级革命家亲手创建的红色医院，具有67年的历史，是一所集医疗、科研、教学、预防保健及康复、急救为一体的大型综合医院。医院分东、西两区。西区占地面积34897平方米，建筑面积85210平方米。实际开放床位1555张，全院科室设置99个，其中临床科室55个，医技科室15个，职能后勤科室29个。医院总资产14.92亿，固定资产9.12亿元。作为市重点项目和全市十大民生工程的医院东区，占地123亩，总投入10亿元，开放床位1369张。届时，“一院两区”总建筑面积将达到22万平方米，总资产20亿元，开放床位2900余张。医院目前拥有在
四川省妇幼保健院,8,儿童保健科,http://yyk.familydoctor.com.cn/18423/, 四川省妇幼保健院成立于1988年4月，1998年5月开展保健和临床业务工作，是一所集保健、临床、业务培训指导、应用科研为一体的省级医疗保健机构，系省卫生厅直属的非营利性事业单位。2003年增挂“四川省妇女儿童医院”。四川省妇幼健康研究所、四川省新生儿疾病筛查中心、四川省产前诊断中心、四川省围产保健重点学科(实验室)设于该院。是四川大学等大中专院校的教学实习基地、专科医师培训基地和成都中医药大学教学医院。中国妇女保健学会围产保健学组、四川省预防医学会妇幼保健专委会和四川省卫生信息学会妇幼卫生信息专委会挂靠该院。1999年被世界卫生组织、联合国儿童基金会、卫生部授予“爱婴医院”称号。2005年，
阜阳市人民医院,8,"心血管内科,神经内科",http://yyk.familydoctor.com.cn/9291/, 阜阳市人民医院建于1949年9月，是集医疗、教学、科研、急救、预防、保健和康复为一体的“三级甲等”综合性医院，国家级“爱婴医院”，是安徽医科大学临床学院和蚌埠医学院附属医院。 【人员结构】医院现有职工2031 人，其中副高职以上职称的专业技术人员185人，博士、硕士研究生186人。 【业务指标】医院编制床位1050张，实际开放床位1300张。2013年门诊量106.7万人次，出院病人5.66万余人次，手术2.1万余台次。 【学科建设】医院科室设置齐全，拥有临床科室29个，医技科室13个。骨科、妇产科是省“十二五”临床医学重点建设项目培育专科;康复医学科是省临床医学重点特色专科;骨科、妇产科、
重庆市开县人民医院,8,,http://yyk.familydoctor.com.cn/1611/, 重庆市开县人民医院始建于1940年，是一所与市级科研机构――重庆市三峡库区自然疫源性疾病临床防治研究所实行院所合一管理的大型综合性三级医院。现为重庆医科大学等三所医学院校教学医院，三峡医药高等专科学校非直属附属医院，重庆市住院医师规范化培训基地，是全县120急救中心。医院坐落在美丽的汉丰湖畔，位于开县县城商业中心地段，占地8.5万O，业务用房15.5万O，总资产7.9亿元，开放床位1500张。门急诊人次、住院人次、手术台次均位居重庆市区县医院前列。 专业队伍实力雄厚，现有职工1350人，其中高级职称116人，重庆市突出贡献中青年专家、优秀技术人才各1人，专业学科带头人18人，博士、硕士研究生
